code,course_name,programme_title,faculty,programme_url,year_num,period,ects,course_level,course_coordinator,teaching_method,course_programmes,course_paragraphs_json,number_programmes,course_objective,course_content,additional_information_teaching_methods,method_of_assessment,literature,additional_information_target_audience,recommended_background_knowledge
E_EBE1_QRM1,Quantitative Research Methods I,Economics and Business Economics,School of Business and Economics,https://studiegids.vu.nl/en/Bachelor/2025-2026/economics-and-business-economics,1.0,1.0,6,100,M.J. Witte,"Instruction course, Computer lab, Written partial exam, Lecture",Economics and Business Economics,"[""Course Objective\nQuantitative Research Methods I is the first course of our academic core, teaching you how to use mathematics to solve analytical problems and research questions (Academic and Research Skills).\nIn this course, you will learn to apply important concepts and techniques from Calculus, Linear Algebra, and Statistics. These tools are not only relevant in an academic setting, but also help you tackle problems in Business and Economics (Bridging Theory and Practice – Knowledge).\nIn addition, throughout this course, you will formulate real-world questions as mathematical problems that you solve, and then translate back to real-world answers (Bridging Theory and Practice – Application).\nAfter completing this course, you can\nread and write mathematical expressions involving variables, constants, and various operators using standard notation;\nmanipulate expressions (e.g. involving the summation operators) and solve equations;\ndifferentiate and integrate functions;\nexplain why derivatives and integrals are intimately related;\nfind extreme values of functions, with and without constraints;\nvisualize and differentiate implicit functions;\nderive the elasticity of a function;\nuse vector and matrix notation;\napply basic matrix operations, such as matrix multiplication and taking the transpose;\nexplain and utilize the properties of the matrix inverse and the identity matrix;\nsolve systems of linear equations;\nformulate and solve linear programming problems;\ncalculate and interpret descriptive statistics;\nwrite mathematical expressions and equations using Microsoft Word;\nuse Microsoft Excel, including the Solver add-in, to solve several mathematical problems covered in this course; and\nexplain the relevance of the techniques covered in this course for Business and Economics."", ""Course Content\nIn Business and Economics, we use many mathematical models and techniques. For instance, the conditions for market and price equilibrium can be formulated mathematically. Similarly, we can use mathematics to quantify risk and optimize investment portfolios. As a result, mathematics is a challenging, but highly relevant topic for students in Business and Economics.\nMathematics is, of course, more than just a set of formulas, calculations, and numbers: it is a language. This language is crucial in developing an analytical way of thinking, that is not only at the core of good academic work, but also key to being a successful professional in Business and Economics. In other words, it is the first step on the path of understanding the power of quantitative and mathematical approaches, to solve problems you will face well beyond your studies.\nIn this course, you will learn about important concepts and techniques from various branches of mathematics, such as Calculus and Linear Algebra. You can use this knowledge to formulate and solve many questions in Business and Economics.\nFor accurate formulation and presentation of such models and techniques, you should be able to typeset formulas, for instance using Microsoft Word. In addition, for many problems, you need to use appropriate software, such as Microsoft Excel, to convert a theoretical solution to an actual, numerical solution. Therefore, in this course, you will also develop these general skills."", ""Additional Information Teaching Methods\nLectures, Tutorials, and Computer tutorials"", ""Method of Assessment\nDigital partial exams and written final exam"", ""Literature\nSydsæter, K., Hammond, P., Strøm, A. and Carvajal, A. (2022), Essential Mathematics for Economic Analysis, 6th edition, Pearson Education.\nAdditional documents via Canvas."", ""Additional Information\nMandatory for Binding Recommendation on Continuation of Studies (BSA) in Year 1.\nYou will work with Microsoft Word and Excel. In the mid-term exams, we use the English versions of Excel and Word."", ""Recommended background knowledge\nActive command of mathematics at the high-school level. It can be helpful to refresh your skills in advance.""]",1,"Quantitative Research Methods I is the first course of our academic core, teaching you how to use mathematics to solve analytical problems and research questions (Academic and Research Skills).
In this course, you will learn to apply important concepts and techniques from Calculus, Linear Algebra, and Statistics. These tools are not only relevant in an academic setting, but also help you tackle problems in Business and Economics (Bridging Theory and Practice – Knowledge).
In addition, throughout this course, you will formulate real-world questions as mathematical problems that you solve, and then translate back to real-world answers (Bridging Theory and Practice – Application).
After completing this course, you can
read and write mathematical expressions involving variables, constants, and various operators using standard notation;
manipulate expressions (e.g. involving the summation operators) and solve equations;
differentiate and integrate functions;
explain why derivatives and integrals are intimately related;
find extreme values of functions, with and without constraints;
visualize and differentiate implicit functions;
derive the elasticity of a function;
use vector and matrix notation;
apply basic matrix operations, such as matrix multiplication and taking the transpose;
explain and utilize the properties of the matrix inverse and the identity matrix;
solve systems of linear equations;
formulate and solve linear programming problems;
calculate and interpret descriptive statistics;
write mathematical expressions and equations using Microsoft Word;
use Microsoft Excel, including the Solver add-in, to solve several mathematical problems covered in this course; and
explain the relevance of the techniques covered in this course for Business and Economics.","In Business and Economics, we use many mathematical models and techniques. For instance, the conditions for market and price equilibrium can be formulated mathematically. Similarly, we can use mathematics to quantify risk and optimize investment portfolios. As a result, mathematics is a challenging, but highly relevant topic for students in Business and Economics.
Mathematics is, of course, more than just a set of formulas, calculations, and numbers: it is a language. This language is crucial in developing an analytical way of thinking, that is not only at the core of good academic work, but also key to being a successful professional in Business and Economics. In other words, it is the first step on the path of understanding the power of quantitative and mathematical approaches, to solve problems you will face well beyond your studies.
In this course, you will learn about important concepts and techniques from various branches of mathematics, such as Calculus and Linear Algebra. You can use this knowledge to formulate and solve many questions in Business and Economics.
For accurate formulation and presentation of such models and techniques, you should be able to typeset formulas, for instance using Microsoft Word. In addition, for many problems, you need to use appropriate software, such as Microsoft Excel, to convert a theoretical solution to an actual, numerical solution. Therefore, in this course, you will also develop these general skills.","Lectures, Tutorials, and Computer tutorials",Digital partial exams and written final exam,"Sydsæter, K., Hammond, P., Strøm, A. and Carvajal, A. (2022), Essential Mathematics for Economic Analysis, 6th edition, Pearson Education.
Additional documents via Canvas.",,Active command of mathematics at the high-school level. It can be helpful to refresh your skills in advance.
E_IBA1_ACSK,Academic Skills,International Business Administration,School of Business and Economics,https://studiegids.vu.nl/en/Bachelor/2025-2026/international-business-administration,1.0,1.0,6,100,dr. S. El Baroudi,"Study Group, Lecture",International Business Administration,"[""Course Objective\nACADEMIC AND RESEARCH SKILLS – Student can conduct a basic international research project from start to finish\nACADEMIC SKILLS (THREE AS)\nAfter successfully completing this course, the student can\nanalyze and demonstrate an understanding of international business problems from deductive and inductive research perspectives (Analysis)\nrecognize fundamental structures and to leave out irrelevant information when examining a research question (Abstraction)\nput forward well-founded, substantiated points of view for deductive and inductive research perspectives, both in spoken and written format (Argumentation)\nRESEARCH SKILLS\nAfter successfully completing this course, the student can\ncritically reflect on (the quality of) academic research\ntranslate practically relevant international business problems into academically relevant research questions\napply basic research skills needed to complete a part of a research process, both quantitative as well as qualitative\nBRIDGING THEORY AND PRACTICE\nKNOWLEDGE: Demonstrates theoretical and empirical knowledge concerning\nthe relevant areas in international business administration\nAfter successfully completing this course, the student:\ncan explain the basic theories, models and concepts related to business research\nis able to make connections between those theories, models, and concepts\nSOCIAL SKILLS – STUDENTS ARE ABLE TO EFFECTIVELY MANAGE DIFFERENT PROFESSIONAL ROLES IN A CROSS-CULTURAL ENVIRONMENT\nAfter successfully completing this course, the student can:\ncommunicate in academic English in writing\nunderstand what academic conduct is and behave in line with that conduct\nBROADENING YOUR HORIZON - STUDENTS ARE ABLE TO REFLECT ON THE ETHICAL AND SOCIAL IMPLICATIONS OF PROFESSIONAL AND GOVERNMENTAL DECISIONS\nAfter successfully completing this course, the student:\nhas a basic understanding of business research from a philosophical and methodological perspective\ncan identify a number of current developments and research gaps in business research\ncan explain basic ethical concerns and dilemmas in business research"", ""Course Content\nIn order to develop yourself as an academic in an international landscape you need to be able to critically reflect on, write about, and eventually also conduct research. In this course you will develop a fundamental skills set that enables you to thrive as an academic throughout your further studies and career. Understanding the academic world and developing related skills starts with understanding the academic community. Fundamental aspects of this community are related to different perspectives on research, the art of critical reasoning, and the language of science. In this course you will reflect on different perspectives on research, start applying academic skills through critical reasoning and writing, and work on doing this in fluent academic English."", ""Additional Information Teaching Methods\nLectures and tutorials"", ""Method of Assessment\nWritten Assignment - Individual assessment\nTeam Assignment - Group assessment\nParticipation Assignment - Group assessment\nParticipation Assignment – Individual assessment"", ""Entry Requirements\nN/A"", ""Literature\nMandatory literature:\nLee, N. & Lings, I. (2008). Doing business research: A guide to theory and practice. London: SAGE Publications.\nAdditional (required) materials will be announced via Canvas."", ""Additional Information Target Audience\nStudents enrolled to the International Business Administration Program"", ""Additional Information\nA blended learning style will be adopted in this course. Students are required to use online tools to successfully complete all course assignments. There will be also face-to-face meetings to discuss relevant content and to receive feedback from tutors."", ""Custom Course Registration\nAll students can register to this course. Teams are formed by the tutors during the first tutorial session."", ""Explanation Canvas\nMaterials, lectures, and assignments are uploaded on Canvas. Students are required to understand how to use Feedback Fruits to evaluate their peers' contribution to discussions."", ""Recommended background knowledge\nn/a""]",1,"ACADEMIC AND RESEARCH SKILLS – Student can conduct a basic international research project from start to finish
ACADEMIC SKILLS (THREE AS)
After successfully completing this course, the student can
analyze and demonstrate an understanding of international business problems from deductive and inductive research perspectives (Analysis)
recognize fundamental structures and to leave out irrelevant information when examining a research question (Abstraction)
put forward well-founded, substantiated points of view for deductive and inductive research perspectives, both in spoken and written format (Argumentation)
RESEARCH SKILLS
After successfully completing this course, the student can
critically reflect on (the quality of) academic research
translate practically relevant international business problems into academically relevant research questions
apply basic research skills needed to complete a part of a research process, both quantitative as well as qualitative
BRIDGING THEORY AND PRACTICE
KNOWLEDGE: Demonstrates theoretical and empirical knowledge concerning
the relevant areas in international business administration
After successfully completing this course, the student:
can explain the basic theories, models and concepts related to business research
is able to make connections between those theories, models, and concepts
SOCIAL SKILLS – STUDENTS ARE ABLE TO EFFECTIVELY MANAGE DIFFERENT PROFESSIONAL ROLES IN A CROSS-CULTURAL ENVIRONMENT
After successfully completing this course, the student can:
communicate in academic English in writing
understand what academic conduct is and behave in line with that conduct
BROADENING YOUR HORIZON - STUDENTS ARE ABLE TO REFLECT ON THE ETHICAL AND SOCIAL IMPLICATIONS OF PROFESSIONAL AND GOVERNMENTAL DECISIONS
After successfully completing this course, the student:
has a basic understanding of business research from a philosophical and methodological perspective
can identify a number of current developments and research gaps in business research
can explain basic ethical concerns and dilemmas in business research","In order to develop yourself as an academic in an international landscape you need to be able to critically reflect on, write about, and eventually also conduct research. In this course you will develop a fundamental skills set that enables you to thrive as an academic throughout your further studies and career. Understanding the academic world and developing related skills starts with understanding the academic community. Fundamental aspects of this community are related to different perspectives on research, the art of critical reasoning, and the language of science. In this course you will reflect on different perspectives on research, start applying academic skills through critical reasoning and writing, and work on doing this in fluent academic English.",Lectures and tutorials,"Written Assignment - Individual assessment
Team Assignment - Group assessment
Participation Assignment - Group assessment
Participation Assignment – Individual assessment","Mandatory literature:
Lee, N. & Lings, I. (2008). Doing business research: A guide to theory and practice. London: SAGE Publications.
Additional (required) materials will be announced via Canvas.",Students enrolled to the International Business Administration Program,n/a
E_IBA1_PBS,People in Business and Society,International Business Administration,School of Business and Economics,https://studiegids.vu.nl/en/Bachelor/2025-2026/international-business-administration,1.0,1.0,6,100,dr. C.E. Rott,"Instruction course, Study Group, Lecture",International Business Administration,"[""Course Objective\nACADEMIC AND RESEARCH SKILLS – STUDENTS CAN CONDUCT A BASIC INTERNATIONAL RESEARCH PROJECT FROM START TO FINISH\nACADEMIC SKILLS (THREE AS):\nAfter successfully completing this course, the student can\nanalyze organizational and cultural challenges from different perspectives (Analysis)\nreflect the main features of complex organizational setups in abstract strategic games and experiments (Abstraction)\nput forward well-founded, substantiated points of view, for possible interventions that help overcome problems in business and society (Argumentation)\nBRIDGING THEORY AND PRACTICE\nKNOWLEDGE: Demonstrates theoretical and empirical knowledge concerning the relevant areas in international business administration.\nAfter successfully completing this course, the student can:\nexplain, contrast, and compare theoretical predictions and experimental results with case studies of culture in organizations\ndescribe theory and related concepts on cross-cultural management and collaboration\ndescribe basic theory on cross-cultural differences in a business related context\nAPPLICATION: Can propose a solution to an international real-life business problem by applying relevant theories and methodologies.\nAfter successfully completing this course, the student can:\nprovide practical solutions for shaping individuals' interactions with others in an inter-cultural workplace\napply theoretical knowledge by comparing theoretical predictions with experimental results and case studies in a specific business situation"", ""Course Content\nDuring this course you are invited to critically think about strategic situations in business and society, collaboration across cultural boundaries, and the role that incentives, culture, and (intercultural) communication play. Raising fundamental topics, you are encouraged to project yourself into the international and intercultural organization to understand the complexities that come with working in a diverse environment. Reflecting on and discussing about strategic games, experimental results, and business cases will help you to translate academic, abstract knowledge into practice while developing your own critical view."", ""Additional Information Teaching Methods\nLectures\nTutorials"", ""Method of Assessment\nWritten Exam - individual assessment\nPractical assignment - group assessment\nParticipation assignment - individual assessment"", ""Literature\nDixit, A. K., & Nalebuff, B. (2008). The art of strategy: a game theorist's guide to success in business & life. WW Norton & Company.\nSections from additional books, scientific articles, and Harvard Business Review articles.""]",1,"ACADEMIC AND RESEARCH SKILLS – STUDENTS CAN CONDUCT A BASIC INTERNATIONAL RESEARCH PROJECT FROM START TO FINISH
ACADEMIC SKILLS (THREE AS):
After successfully completing this course, the student can
analyze organizational and cultural challenges from different perspectives (Analysis)
reflect the main features of complex organizational setups in abstract strategic games and experiments (Abstraction)
put forward well-founded, substantiated points of view, for possible interventions that help overcome problems in business and society (Argumentation)
BRIDGING THEORY AND PRACTICE
KNOWLEDGE: Demonstrates theoretical and empirical knowledge concerning the relevant areas in international business administration.
After successfully completing this course, the student can:
explain, contrast, and compare theoretical predictions and experimental results with case studies of culture in organizations
describe theory and related concepts on cross-cultural management and collaboration
describe basic theory on cross-cultural differences in a business related context
APPLICATION: Can propose a solution to an international real-life business problem by applying relevant theories and methodologies.
After successfully completing this course, the student can:
provide practical solutions for shaping individuals' interactions with others in an inter-cultural workplace
apply theoretical knowledge by comparing theoretical predictions with experimental results and case studies in a specific business situation","During this course you are invited to critically think about strategic situations in business and society, collaboration across cultural boundaries, and the role that incentives, culture, and (intercultural) communication play. Raising fundamental topics, you are encouraged to project yourself into the international and intercultural organization to understand the complexities that come with working in a diverse environment. Reflecting on and discussing about strategic games, experimental results, and business cases will help you to translate academic, abstract knowledge into practice while developing your own critical view.","Lectures
Tutorials","Written Exam - individual assessment
Practical assignment - group assessment
Participation assignment - individual assessment","Dixit, A. K., & Nalebuff, B. (2008). The art of strategy: a game theorist's guide to success in business & life. WW Norton & Company.
Sections from additional books, scientific articles, and Harvard Business Review articles.",,
