code,course_name,programme_title,faculty,programme_url,year_num,period,ects,course_level,course_coordinator,teaching_method,course_programmes,course_paragraphs_json,number_programmes,course_objective,course_content,additional_information_teaching_methods,method_of_assessment,literature,additional_information_target_audience,recommended_background_knowledge
L_AABAOHW115,Objects in Context. An Interdisciplinary Perspective on the Ancient World,Ancient Studies,Faculty of Humanities,https://studiegids.vu.nl/en/Bachelor/2025-2026/ancient-studies,1.0,1.0,6,100,prof. dr. J.P. Crielaard,Lecture,Ancient Studies,"[""Course Objective\nA distinct feature of Ancient Studies is the combined use of written and material sources. In this course the focus is on material culture, and how this can be used as a source of information about the past. You will familiarize yourself with some of the main categories of objects such as statues, reliefs, coins and utensils as well as with complex assemblages that are part of the sacred, domestic and funerary domain. An important issue is how we evaluate objects as sources of historical information about the past. What are the possibilities and limitations? What types of questions can we ask? For this we take a closer look at the historical context of material sources: we explore why material culture was created by people in the past, and how this affects our image of antiquity. Special attention will be paid to confronting material and literary information, and to those cases where they seem to contradict each other.\nAt the end of this course, you can:\nevaluate various categories of objects as sources of historical information about the past\nexplain basic theories regarding the use of objects as historical source\napply these insights to an actual object\nfind relevant scholarship and primary sources\nwrite a brief annotated academic text"", ""Course Content\nIn this course you will familiarize yourself with some basic theories regarding the use of material sources to generate information about the past. In addition to this, you will perform your own research on selected objects from the archaeological collection of the Allard Pierson. Doing so, you will get acquainted with the university library and acquire basic academic skills such as how to draft an academic text, how to find relevant scholarship and primary sources, how to provide adequate annotation and how to draw up a bibliography.\nTogether with ‘Historical Sources’ in period 3, this course lays the foundation for the interdisciplinary approach that characterizes Ancient Studies. You learn how to use and evaluate objects as sources of information about the past, and to combine and confront these with data from written evidence. You pursue this approach and method in the rest of your study program."", ""Additional Information Teaching Methods\nLectures and seminars (3 x 2hrs p/w)"", ""Method of Assessment\nMultiple choice exam (40%)\nSet-up for writing assignment (completed/not-completed)\nWriting assignment (60%)\nThis course is part of the learning path Academic Skills for Ancient Studies students. Students will be introduced into the rules of setting up an academic bibliography and reference system and train their writing skills."", ""Additional Information\nThis course is part of a joined programme by the Vrije Universiteit Amsterdam (VU) and the University of Amsterdam (UvA). It is taught at a UvA location. For the course schedule see https://rooster.uva.nl/"", ""Custom Course Registration\nFirst year ACASA students are automatically placed.\nThis course is not open for elective students.\nPlease note: This course is scheduled at the University of Amsterdam""]",1,"A distinct feature of Ancient Studies is the combined use of written and material sources. In this course the focus is on material culture, and how this can be used as a source of information about the past. You will familiarize yourself with some of the main categories of objects such as statues, reliefs, coins and utensils as well as with complex assemblages that are part of the sacred, domestic and funerary domain. An important issue is how we evaluate objects as sources of historical information about the past. What are the possibilities and limitations? What types of questions can we ask? For this we take a closer look at the historical context of material sources: we explore why material culture was created by people in the past, and how this affects our image of antiquity. Special attention will be paid to confronting material and literary information, and to those cases where they seem to contradict each other.
At the end of this course, you can:
evaluate various categories of objects as sources of historical information about the past
explain basic theories regarding the use of objects as historical source
apply these insights to an actual object
find relevant scholarship and primary sources
write a brief annotated academic text","In this course you will familiarize yourself with some basic theories regarding the use of material sources to generate information about the past. In addition to this, you will perform your own research on selected objects from the archaeological collection of the Allard Pierson. Doing so, you will get acquainted with the university library and acquire basic academic skills such as how to draft an academic text, how to find relevant scholarship and primary sources, how to provide adequate annotation and how to draw up a bibliography.
Together with ‘Historical Sources’ in period 3, this course lays the foundation for the interdisciplinary approach that characterizes Ancient Studies. You learn how to use and evaluate objects as sources of information about the past, and to combine and confront these with data from written evidence. You pursue this approach and method in the rest of your study program.",Lectures and seminars (3 x 2hrs p/w),"Multiple choice exam (40%)
Set-up for writing assignment (completed/not-completed)
Writing assignment (60%)
This course is part of the learning path Academic Skills for Ancient Studies students. Students will be introduced into the rules of setting up an academic bibliography and reference system and train their writing skills.",,,
L_AABAOHW101,The Classical Canon I: The Heritage of Antiquity,Ancient Studies,Faculty of Humanities,https://studiegids.vu.nl/en/Bachelor/2025-2026/ancient-studies,1.0,1.0,6,100,prof. dr. mr. R.J. Allan,"Seminar, Lecture","Ancient Studies; Archaeology; Communication and Information Studies; Greek and Latin Languages and Cultures; History; Literature and Society; Media, Art, Design and Architecture; Philosophy","[""Course Objective\nThis first canon module (followed up by a module in year 2 for regular students, but also set up as ‘stand alone’ elective) gives an introduction to the texts, items, places and monuments that belong to the 'Classical' canon, or have once belonged to it. After a general introduction, it offers broad outlines of the contents, contexts and uses of canonical works, persons and events, such as the Bible, the Gilgamesh epos, Homer, Virgil, ancient tragedians and lyricists, the Athenian Akropolis, the Ara Pacis, the battle of Thermopylai etc. Examples will be taken from literature, archaeology, history, history of art and urban studies, or regard so-called lieux de mémoire. They will be ordered thematically in combinations of several items. A lecture is devoted a single theme or a category of canonical works, persons or events, suggesting links and connections between them. The examples will normally be taken from the ancient world, but they will be viewed in the perspective of the roles they have played in later times, and of their roles in the formation of later canons. Reception of canonical items and their continuous presence through time are an important focus of the module.\nAcquiring basic knowledge about the (various) contents, cultural contexts, causes and uses of (the) classical canon(s);\nBeing able to reproduce an overview of the main constituents of the present day ‘classical canon’ from the Ancient Near East to Late Antiquity\nBeing able to reproduce a basic chronology; to distinguish various ‘genres’/disciplines; an to generally contextualise various canons and their functions, and canonical items within that\nBeing able to switch between various ‘genres’/disciplines/artistic media/periods/cultural areas\nBeing able to identify specific and more general parts of the canon"", ""Course Content\nThis course prepares for the module ‘Canon II’ on modern theory concerning canons and canonicity, but can also be taken as a separate (elective) module. Besides reading texts relevant to the case studies, students will have to present a case study in a group presentation."", ""Additional Information Teaching Methods\nLectures/seminars, 2 x 2 hours\nThe first half of the course (weeks 2-4) consists of lectures; the second half (weeks 5-7) consists of a lecture and a seminar (mainly for the group presentations) each week. Presence for the seminars is required."", ""Method of Assessment\nOral presentation of a group project (40% of the final grade). Students conduct a small research project on a canonical item (not discussed in class) and its meaning through time. The results of the project are presented orally to the other students during one of the seminars.\nWritten exam in week 8 , based on the contents of the readings and the case studies presented in the lectures and the seminars (60% of the final grade).\nThis course is part of the learning path Academic Skills of the BA programme Ancient Studies (Oudheidwetenschappen). Students train their presentation skills.\nResit regulations regarding the assignments are specified in the study manual."", ""Literature\nA selection of articles and book chapters which are freely available online (Canvas) or through the library. Students prepare for the sessions by reading an article/chapter of secondary literature and/or (in some of the seminars) by watching recorded materials. Some of the reading/viewing will be discussed in class, other texts serve as a background useful to better understand lectures, or offer additional information."", ""Additional Information Target Audience\nFirst year students --> Bachelor's in Ancient Studies and elective students."", ""Additional Information\nThis course is part of a joined programme by the Vrije Universiteit Amsterdam (VU) and the University of Amsterdam (UvA). It is taught at a UvA location. For the course schedule see https://rooster.uva.nl/"", ""Custom Course Registration\nFirst year ACASA students are automatically placed. Other students can register for this course via UvA https://glass.uva.nl\nVU students who would like to follow this course as an elective need to request a guest registration at the UvA. See for more information: https://www.uva.nl/en/education/other-programmes/electives/electives.html\nPlease note:\nCourse registration periods between VU and UvA differ.\nThis course is scheduled at the University of Amsterdam.""]",8,"This first canon module (followed up by a module in year 2 for regular students, but also set up as ‘stand alone’ elective) gives an introduction to the texts, items, places and monuments that belong to the 'Classical' canon, or have once belonged to it. After a general introduction, it offers broad outlines of the contents, contexts and uses of canonical works, persons and events, such as the Bible, the Gilgamesh epos, Homer, Virgil, ancient tragedians and lyricists, the Athenian Akropolis, the Ara Pacis, the battle of Thermopylai etc. Examples will be taken from literature, archaeology, history, history of art and urban studies, or regard so-called lieux de mémoire. They will be ordered thematically in combinations of several items. A lecture is devoted a single theme or a category of canonical works, persons or events, suggesting links and connections between them. The examples will normally be taken from the ancient world, but they will be viewed in the perspective of the roles they have played in later times, and of their roles in the formation of later canons. Reception of canonical items and their continuous presence through time are an important focus of the module.
Acquiring basic knowledge about the (various) contents, cultural contexts, causes and uses of (the) classical canon(s);
Being able to reproduce an overview of the main constituents of the present day ‘classical canon’ from the Ancient Near East to Late Antiquity
Being able to reproduce a basic chronology; to distinguish various ‘genres’/disciplines; an to generally contextualise various canons and their functions, and canonical items within that
Being able to switch between various ‘genres’/disciplines/artistic media/periods/cultural areas
Being able to identify specific and more general parts of the canon","This course prepares for the module ‘Canon II’ on modern theory concerning canons and canonicity, but can also be taken as a separate (elective) module. Besides reading texts relevant to the case studies, students will have to present a case study in a group presentation.","Lectures/seminars, 2 x 2 hours
The first half of the course (weeks 2-4) consists of lectures; the second half (weeks 5-7) consists of a lecture and a seminar (mainly for the group presentations) each week. Presence for the seminars is required.","Oral presentation of a group project (40% of the final grade). Students conduct a small research project on a canonical item (not discussed in class) and its meaning through time. The results of the project are presented orally to the other students during one of the seminars.
Written exam in week 8 , based on the contents of the readings and the case studies presented in the lectures and the seminars (60% of the final grade).
This course is part of the learning path Academic Skills of the BA programme Ancient Studies (Oudheidwetenschappen). Students train their presentation skills.
Resit regulations regarding the assignments are specified in the study manual.","A selection of articles and book chapters which are freely available online (Canvas) or through the library. Students prepare for the sessions by reading an article/chapter of secondary literature and/or (in some of the seminars) by watching recorded materials. Some of the reading/viewing will be discussed in class, other texts serve as a background useful to better understand lectures, or offer additional information.",First year students --> Bachelor's in Ancient Studies and elective students.,
L_AABACIW102,Introduction to Communication Studies,Communication and Information Studies,Faculty of Humanities,https://studiegids.vu.nl/en/Bachelor/2025-2026/communication-and-information-studies,1.0,1.0,6,100,dr. L.M. van Burgsteden MA,"Seminar*, Lecture",Communication and Information Studies,"[""Course Objective\nTo acquire knowledge of prominent theories of communication;\nTo acquire knowledge of the interdisciplinary nature of communication studies (intertwining psychological, sociological, and language theories);\nTo learn how to read and interpret research literature;\nTo apply knowledge of communication studies to relevant cases;\nTo discuss and critically analyse communication theories and research."", ""Course Content\nThe field of Communication Studies is interdisciplinary, which means that several different scientific approaches and methods are employed together, sometimes supporting and sometimes contradicting each other. As a result, many different theories of human communication have been developed, focusing on the language used in communication messages, communicators' psychological preoccupations, or societal effects of mediated communication. Several theories will be introduced and discussed with a focus on what the theories' advantages and limitations are, and on how the theories can be used to conduct communication research. Explanatory lectures will alternate with seminars, with a focus to both facilitating conceptual understanding and preparing for the exam."", ""Additional Information Teaching Methods\nDuring six weeks, two lectures a week will be given about the various communication theories. Besides the lectures, there will be one seminar every week to discuss assignments and prepare for the written examination. Seminar attendance is mandatory.\nVery important to note: This course has seminars, but you cannot self-register for a group. If you want to know the times of all the workgroups, go to rooster.vu.nl, click on the options at the right-hand side of the course title and select ‘Choose groups’. In the first week, your specific seminar group will be assigned by the course coordinator."", ""Method of Assessment\nWeekly quizzes will comprise 30% of the grade (assessment of learning objective 1 and 2). At the end of the course, there will be a written exam, worth 70% of the grade (assessment of learning objective 1 and 2). During the mandatory seminars, students will work in groups to discuss the weekly literature in the light of in-class assignments (assessment of learning objective 3, 4 and 5)"", ""Literature\nGriffin, Emory A., Ledbetter, Andrew, & Sparks, Glenn. (2023). A first look at communication theory (11th ed.). McGraw-Hill Education."", ""Additional Information Target Audience\nFirst-year Bachelor's students in Communication and Information Studies (CIS)."", ""Additional Information\nThe Griffin, Ledbetter, & Sparks (2023) textbook will also be used in the course Language, Media and Communication in period 2.""]",1,"To acquire knowledge of prominent theories of communication;
To acquire knowledge of the interdisciplinary nature of communication studies (intertwining psychological, sociological, and language theories);
To learn how to read and interpret research literature;
To apply knowledge of communication studies to relevant cases;
To discuss and critically analyse communication theories and research.","The field of Communication Studies is interdisciplinary, which means that several different scientific approaches and methods are employed together, sometimes supporting and sometimes contradicting each other. As a result, many different theories of human communication have been developed, focusing on the language used in communication messages, communicators' psychological preoccupations, or societal effects of mediated communication. Several theories will be introduced and discussed with a focus on what the theories' advantages and limitations are, and on how the theories can be used to conduct communication research. Explanatory lectures will alternate with seminars, with a focus to both facilitating conceptual understanding and preparing for the exam.","During six weeks, two lectures a week will be given about the various communication theories. Besides the lectures, there will be one seminar every week to discuss assignments and prepare for the written examination. Seminar attendance is mandatory.
Very important to note: This course has seminars, but you cannot self-register for a group. If you want to know the times of all the workgroups, go to rooster.vu.nl, click on the options at the right-hand side of the course title and select ‘Choose groups’. In the first week, your specific seminar group will be assigned by the course coordinator.","Weekly quizzes will comprise 30% of the grade (assessment of learning objective 1 and 2). At the end of the course, there will be a written exam, worth 70% of the grade (assessment of learning objective 1 and 2). During the mandatory seminars, students will work in groups to discuss the weekly literature in the light of in-class assignments (assessment of learning objective 3, 4 and 5)","Griffin, Emory A., Ledbetter, Andrew, & Sparks, Glenn. (2023). A first look at communication theory (11th ed.). McGraw-Hill Education.",First-year Bachelor's students in Communication and Information Studies (CIS).,
