code,course_name,programme_title,faculty,programme_url,year_num,period,ects,course_level,course_coordinator,teaching_method,course_programmes,course_paragraphs_json,number_programmes,course_objective,course_content,additional_information_teaching_methods,method_of_assessment,literature,additional_information_target_audience,recommended_background_knowledge
X_400638,Linear Algebra,Econometrics and Operations Research,Faculty of Science,https://studiegids.vu.nl/en/Bachelor/2025-2026/econometrics-and-operations-research,1.0,1.0,6,100,dr. S.D. Barthel,"Seminar, Written partial exam, Lecture",,"[""Course Objective\nAfter this course...\nthe student is able to solve linear systems of equations.\nthe student is able to invert matrices, and to characterise (non)invertible matrices.\nthe student is able to compute the determinant of a matrix, and to use it in different linear algebra contexts.\nthe student can apply the theory of vector spaces to linear algebra problems, can calculate a basis for (sub)spaces.\nthe student can calculate the eigenvalues and eigenvectors of a matrix, can perform a diagonalisation, and can use these techniques to study linear difference equations.\nthe student can orthogonalise a set of vectors, can work with inner products and norms, and can perform projections on subspaces.\nthe student can show whether a quadratic form is positive or negative definite, and can perform a Singular Value Decomposition.\nthe student can prove small linear algebra theorems in a logical mathematical argument."", ""Course Content\nThe following subjects will be covered in this course:\nsolving systems of linear equations;\nlinear (in)dependence;\nmatrix operations;\ndeterminants;\nvector spaces and subspaces;\nbasis and dimension of vector spaces;\nrank of a matrix, the rank theorem;\ncoordinate systems and changes of basis;\neigenvalues and eigenvectors;\ndiagonalisation of matrices;\nQR factorisations of a matrix;\ninner product, length, orthogonality;\northogonal projections, method of least squares;\nsymmetric matrices and their orthogonal diagonalisation;\nquadratic forms;\nsingular value decomposition of a matrix"", ""Additional Information Teaching Methods\nEvery week there are two lectures and one exercise class, of two hours\neach."", ""Method of Assessment\nThis course has two written exams, one in each period. Additionally, there are two short written tests made during the tutorials. You will have passed the course if you meet the following requirements:\nat least a 5.0 for the first exam;\nat least a 5.0 for the second exam;\nat least a 5.5 on average;\nThe exams and the short tests together form your final grade as follows:\n30% for exam 1,\n50% for exam 2,\n20% for the average of the short tests.\nStudents that cannot or do not have to take part in the tutorials/short tests (as decided by the study advisor, for example part time students) receive their final grades as 40% for the first exam and 60% for the second.\nYour final grade is rounded to the nearest half point, taking into account that averages between 5.0 and 6.0 are rounded to the nearest integer.\nResits:\nIn case you failed the course, you need to take a resit to pass the course, an exam that covers the entire contents of the course. The short tests form 20% of your resit grade, if and only if this yields a higher final grade."", ""Literature\nDavid C. Lay, Stephen R. Lay and Judi J. McDonald, Linear Algebra and its Applications, 5th edition, Pearson Global Edition, ISBN-139781292092232"", ""Additional Information Target Audience\nBachelor Mathematics Year 1, Bachelor EOR Year 1"", ""Recommended background knowledge\nHigh school mathematics""]",5,"After this course...
the student is able to solve linear systems of equations.
the student is able to invert matrices, and to characterise (non)invertible matrices.
the student is able to compute the determinant of a matrix, and to use it in different linear algebra contexts.
the student can apply the theory of vector spaces to linear algebra problems, can calculate a basis for (sub)spaces.
the student can calculate the eigenvalues and eigenvectors of a matrix, can perform a diagonalisation, and can use these techniques to study linear difference equations.
the student can orthogonalise a set of vectors, can work with inner products and norms, and can perform projections on subspaces.
the student can show whether a quadratic form is positive or negative definite, and can perform a Singular Value Decomposition.
the student can prove small linear algebra theorems in a logical mathematical argument.","The following subjects will be covered in this course:
solving systems of linear equations;
linear (in)dependence;
matrix operations;
determinants;
vector spaces and subspaces;
basis and dimension of vector spaces;
rank of a matrix, the rank theorem;
coordinate systems and changes of basis;
eigenvalues and eigenvectors;
diagonalisation of matrices;
QR factorisations of a matrix;
inner product, length, orthogonality;
orthogonal projections, method of least squares;
symmetric matrices and their orthogonal diagonalisation;
quadratic forms;
singular value decomposition of a matrix","Every week there are two lectures and one exercise class, of two hours
each.","This course has two written exams, one in each period. Additionally, there are two short written tests made during the tutorials. You will have passed the course if you meet the following requirements:
at least a 5.0 for the first exam;
at least a 5.0 for the second exam;
at least a 5.5 on average;
The exams and the short tests together form your final grade as follows:
30% for exam 1,
50% for exam 2,
20% for the average of the short tests.
Students that cannot or do not have to take part in the tutorials/short tests (as decided by the study advisor, for example part time students) receive their final grades as 40% for the first exam and 60% for the second.
Your final grade is rounded to the nearest half point, taking into account that averages between 5.0 and 6.0 are rounded to the nearest integer.
Resits:
In case you failed the course, you need to take a resit to pass the course, an exam that covers the entire contents of the course. The short tests form 20% of your resit grade, if and only if this yields a higher final grade.","David C. Lay, Stephen R. Lay and Judi J. McDonald, Linear Algebra and its Applications, 5th edition, Pearson Global Edition, ISBN-139781292092232","Bachelor Mathematics Year 1, Bachelor EOR Year 1",High school mathematics
E_EOR1_PT,Probability Theory,Econometrics and Operations Research,School of Business and Economics,https://studiegids.vu.nl/en/Bachelor/2025-2026/econometrics-and-operations-research,1.0,1.0,6,100,B. van Os,"Study Group, Written partial exam, Lecture",,"[""Course Objective\nThe learning objectives are as follows:\nKnowledge and understanding of basic concepts of probability theory and probability distributions.\nSelecting an appropriate method to solve typical problems in probability theory and applying these methods correctly.\nTranslating verbally described problems in the language of probability theory to solve the problems.\nKnowledge of probability distributions which occur most commonly in practice and being able to use the known properties of these distributions to solve problems."", ""Course Content\nThe mathematical foundation for both modelling decisions under uncertainty when performing statistics is probability theory and probability theory therefore has a central role in the bachelor Econometrics and Operations Research.\nThe structure of this course is as follows:\nIntroduction of basic elements of the probability theory (random experiment, outcomes space, eventuality and opportunity) and fundamental calculation rules for combinations, permutations.\nDiscussion of axioms of probability, combinatorial probability models, conditional probabilities, the rule of Bayes, and the law of total probability.\nIntroduction of the concept of a random variable, and concepts such as distribution function, probability mass function, expectation and variance of a random variable.\nDiscussion of specific discrete probability distributions, such as the binomial, hypergeometric, Poisson, and geometric distribution.\nIntroduction of continuous random variables and associated probability density and distribution functions.\nDiscussion of specific continuous probability distributions such as the uniform, normal, exponential and gamma distribution. Relations between these continuous probability distributions and the previously introduced discrete probability distributions are discussed.\nDiscussion of the concepts of bivariate and multivariate probability distributions and related concepts such as joint and marginal distribution functions, conditional probability distribution, and independence of stochastic variables.\nDiscussion of moment generating functions.\nIntroduction of the limit theorems such as laws of large numbers and the central limit theorem."", ""Additional Information Teaching Methods\nLectures and Work groups"", ""Method of Assessment\nMidterm exam - individual mark\nFinal exam - individual mark"", ""Literature\nAuthor: Saeed Ghahramani; Title: Fundamentals of Probability (with stochastic processes); Fourth Edition; publication year: 2018; publisher: CRC Press, Taylor & Francis Group; EAN: 9781498755092"", ""Recommended background knowledge\nGood knowledge and skill of mathematics taught at VWO.""]",4,"The learning objectives are as follows:
Knowledge and understanding of basic concepts of probability theory and probability distributions.
Selecting an appropriate method to solve typical problems in probability theory and applying these methods correctly.
Translating verbally described problems in the language of probability theory to solve the problems.
Knowledge of probability distributions which occur most commonly in practice and being able to use the known properties of these distributions to solve problems.","The mathematical foundation for both modelling decisions under uncertainty when performing statistics is probability theory and probability theory therefore has a central role in the bachelor Econometrics and Operations Research.
The structure of this course is as follows:
Introduction of basic elements of the probability theory (random experiment, outcomes space, eventuality and opportunity) and fundamental calculation rules for combinations, permutations.
Discussion of axioms of probability, combinatorial probability models, conditional probabilities, the rule of Bayes, and the law of total probability.
Introduction of the concept of a random variable, and concepts such as distribution function, probability mass function, expectation and variance of a random variable.
Discussion of specific discrete probability distributions, such as the binomial, hypergeometric, Poisson, and geometric distribution.
Introduction of continuous random variables and associated probability density and distribution functions.
Discussion of specific continuous probability distributions such as the uniform, normal, exponential and gamma distribution. Relations between these continuous probability distributions and the previously introduced discrete probability distributions are discussed.
Discussion of the concepts of bivariate and multivariate probability distributions and related concepts such as joint and marginal distribution functions, conditional probability distribution, and independence of stochastic variables.
Discussion of moment generating functions.
Introduction of the limit theorems such as laws of large numbers and the central limit theorem.",Lectures and Work groups,"Midterm exam - individual mark
Final exam - individual mark","Author: Saeed Ghahramani; Title: Fundamentals of Probability (with stochastic processes); Fourth Edition; publication year: 2018; publisher: CRC Press, Taylor & Francis Group; EAN: 9781498755092",,Good knowledge and skill of mathematics taught at VWO.
L_AABAGESACS,Academic Skills for Historians,History,Faculty of Humanities,https://studiegids.vu.nl/en/Bachelor/2025-2026/history,1.0,1.0,6,100,dr. L.M. Poy López,"Seminar*, Lecture",,"[""Course Objective\nDuring the course, students acquire skills and study habits that are essential for analysing academic literature and primary sources, and for writing academic papers. Students also deepen their knowledge on the historiography of an specific historical topic, resulting in the writing of a historiographical essay or “status quaestionis”.\nUpon completion of the course, students will be able to:\nUnderstand the difference between primary and secondary sources\nFind, select, and assess scientific literature\nCritically use reference works and online resources\nAnalyze and summarize scientific literature\nRecognize several approaches and points of view within an academic debate\nFormulate a hypothesis, identify a problem, and elaborate on these by using smaller sub-questions\nUnderstand scholarly rules for annotation and bibliography\nProcess feedback (given by teachers and fellow students)\nCarry out self-evaluation and peer evaluation\nWrite a status quaestionis in which they analyse scientific literature"", ""Course Content\nDuring your studies, you will conduct independent research based on scientific literature and primary sources from the past. You will also present the results of your research to others in an accessible and understandable manner, by writing essays and a thesis. A crucial first step in this process is to be able to describe clearly and accurately what scholars before you have written about the subject, and what questions remain unanswered. This is called the ‘status quaestionis’. During this course, you will acquire the necessary skills to write a good status quaestionis with proper annotations, which results in a relevant research question.\nA first skill implies gathering and evaluating scientific information. You will be introduced to the organization and facilities of the VU’s library (UBVU). You will also be acquainted with the conventions on describing and registering bibliographical data in footnotes and bibliographies. Additionally, we will discuss digital forms of information gathering, such as the use of online catalogues, (academic) search engines, and bibliographical reference works.\nThe ability to make a critical assessment of information is a crucial skill for historians. Anyone conducting research for an essay, course assignment, or thesis, will be constantly confronted with a myriad of facts, knowledge, and interpretations. The value of those is not inherently established. In ‘Academic Skills for Historians’, you will learn how to assess the reliability and partiality of information.\nA second crucial academic ability is the processing and interpreting of information. How do you summarize a scientific article or an academic debate? How do you distinguish between a well-founded and an unsubstantiated opinion? What is the research question put forward in a scholarly article and how does it relate to broader issues? Which approach was adopted by the author, and which primary sources have been used? How did the author justify their methodology?\nDuring the course, you will write your own status quaestionis, step by step, according to the rules of the profession. A status quaestionis is a summary of existing knowledge on a certain theme which leads towards a clear research question. Through several practical exercises, you will be acquainted with all aspects of the writing process. You will learn how to find other articles and books on the same topic, how to write a good summary, how to structure a text, how to present arguments of others and how to use your own voice, and how to formulate a good research question. Next to addressing these issues, the teachers will also discuss practical matters such as work organization, writing strategies, planning and time management. Dealing with feedback, peer review and self-criticism is a crucial aspect of the learning process."", ""Additional Information Teaching Methods\nThe course is divided into lectures and seminars. Classes are scheduled twice a week and last two hours each time. Attendance is compulsory. Students who have a reason to be absent must inform the course coordinator in time, and may only be absent a maximum of two times, after which they may be excluded from the course."", ""Method of Assessment\nStudents are required to submit small weekly assignments. These are formative and will be marked as “Complete” or “Incomplete”. Feedback will be provided.\nAt the end of the course, students will submit their final piece of work, the status quaestionis. This paper can receive three grades:\nPass:\nFail: Revision is necessary.\nFail: A new status quaestionis is required."", ""Literature\nStudents must read chapters and academic articles on the topic of their choice for the final paper.\nThere is a reference book that discusses academic skills and provides help with writing footnotes and references:\nJeannette Kamp, Susan Legêne, Matthias van Rossum, Sebas Rümke, Writing History! A Companion for Historians (Amsterdam University Press, 2018). ISBN 9789462986398 (mandatory)."", ""Additional Information Target Audience\nBA1 Students History: History and International Studies."", ""Additional Information\nThis course is mandatory for first-year students of History: History and International Studies and has to be successfully completed in order to obtain a positive binding study advice (BSA). For this module, following and passing the English Language Test (L_ELT) is a prerequisite for awarding the obtained credits. The course is not open to exchange students."", ""Custom Course Registration\nFor this course, registration differs from the standard procedure at the Faculty of Humanities (in which students register themselves). The instructors will make a division into several seminars, after which further registration will be completed by the Education Office. This means students should register for the course ‘Academic Skills’ themselves, but they cannot register for a particular seminar."", ""Explanation Canvas\nCanvas is used for this course.""]",1,"During the course, students acquire skills and study habits that are essential for analysing academic literature and primary sources, and for writing academic papers. Students also deepen their knowledge on the historiography of an specific historical topic, resulting in the writing of a historiographical essay or “status quaestionis”.
Upon completion of the course, students will be able to:
Understand the difference between primary and secondary sources
Find, select, and assess scientific literature
Critically use reference works and online resources
Analyze and summarize scientific literature
Recognize several approaches and points of view within an academic debate
Formulate a hypothesis, identify a problem, and elaborate on these by using smaller sub-questions
Understand scholarly rules for annotation and bibliography
Process feedback (given by teachers and fellow students)
Carry out self-evaluation and peer evaluation
Write a status quaestionis in which they analyse scientific literature","During your studies, you will conduct independent research based on scientific literature and primary sources from the past. You will also present the results of your research to others in an accessible and understandable manner, by writing essays and a thesis. A crucial first step in this process is to be able to describe clearly and accurately what scholars before you have written about the subject, and what questions remain unanswered. This is called the ‘status quaestionis’. During this course, you will acquire the necessary skills to write a good status quaestionis with proper annotations, which results in a relevant research question.
A first skill implies gathering and evaluating scientific information. You will be introduced to the organization and facilities of the VU’s library (UBVU). You will also be acquainted with the conventions on describing and registering bibliographical data in footnotes and bibliographies. Additionally, we will discuss digital forms of information gathering, such as the use of online catalogues, (academic) search engines, and bibliographical reference works.
The ability to make a critical assessment of information is a crucial skill for historians. Anyone conducting research for an essay, course assignment, or thesis, will be constantly confronted with a myriad of facts, knowledge, and interpretations. The value of those is not inherently established. In ‘Academic Skills for Historians’, you will learn how to assess the reliability and partiality of information.
A second crucial academic ability is the processing and interpreting of information. How do you summarize a scientific article or an academic debate? How do you distinguish between a well-founded and an unsubstantiated opinion? What is the research question put forward in a scholarly article and how does it relate to broader issues? Which approach was adopted by the author, and which primary sources have been used? How did the author justify their methodology?
During the course, you will write your own status quaestionis, step by step, according to the rules of the profession. A status quaestionis is a summary of existing knowledge on a certain theme which leads towards a clear research question. Through several practical exercises, you will be acquainted with all aspects of the writing process. You will learn how to find other articles and books on the same topic, how to write a good summary, how to structure a text, how to present arguments of others and how to use your own voice, and how to formulate a good research question. Next to addressing these issues, the teachers will also discuss practical matters such as work organization, writing strategies, planning and time management. Dealing with feedback, peer review and self-criticism is a crucial aspect of the learning process.","The course is divided into lectures and seminars. Classes are scheduled twice a week and last two hours each time. Attendance is compulsory. Students who have a reason to be absent must inform the course coordinator in time, and may only be absent a maximum of two times, after which they may be excluded from the course.","Students are required to submit small weekly assignments. These are formative and will be marked as “Complete” or “Incomplete”. Feedback will be provided.
At the end of the course, students will submit their final piece of work, the status quaestionis. This paper can receive three grades:
Pass:
Fail: Revision is necessary.
Fail: A new status quaestionis is required.","Students must read chapters and academic articles on the topic of their choice for the final paper.
There is a reference book that discusses academic skills and provides help with writing footnotes and references:
Jeannette Kamp, Susan Legêne, Matthias van Rossum, Sebas Rümke, Writing History! A Companion for Historians (Amsterdam University Press, 2018). ISBN 9789462986398 (mandatory).",BA1 Students History: History and International Studies.,
