code,course_name,programme_title,faculty,programme_url,year_num,period,ects,course_level,course_coordinator,teaching_method,course_programmes,course_paragraphs_json,number_programmes,course_objective,course_content,additional_information_teaching_methods,method_of_assessment,literature,additional_information_target_audience,recommended_background_knowledge
L_ALBALES101,"Literature, Culture and Society",Literature and Society,Faculty of Humanities,https://studiegids.vu.nl/en/Bachelor/2025-2026/literature-and-society,1.0,1.0,6,100,dr. A.S. Raghunath,"Seminar*, Practical",,"[""Course Objective\nAt the end of the course:\nStudents will be able to recall key concepts and debates about the relationship between literature and society.\nStudents will understand, interpret and explain literary and critical texts from diverse national, cultural, and historical backgrounds.\nStudents will be able to apply their knowledge to a variety of literary texts and present their research findings both in writing and verbally.\nStudents will analyse and break down complex texts and debates to understand their components and relationships.\nStudents will be able to evaluate, assess and critique literary works and peer feedback, providing constructive criticism.\nStudents will creatively produce original research and presentations, synthesising their understanding and analysis of the texts."", ""Course Content\nFor centuries, literary and other cultural texts have changed the way people think and look at the world. They reveal social injustices and societal ills, offering ideas and ammunition for social change, thereby helping people to imagine different, better realities. A single text may trigger an individual’s struggle for emancipation, but also that of a group or a nation. This course will explore the important ways in which literary texts have contributed to societal change and have liberated people throughout the centuries up to the present.\nThe texts we discuss have instigated individual readers as well as collectivities to discover and become aware of injustices, unfairness and abuse. This course analyzes that process, using the following questions as leading threads in the discussions: Which rhetorical strategies employed in the texts evoke the readers’ empathy and possible agency? How do the texts simultaneously assist in emboldening the reader, strengthening an emerging community, and gaining acceptance from a wider audience? In which way do they balance realities that are already being lived and imagined possibilities that have yet to materialize? How do they interact with other expressions of the struggle for emancipation, by way of imitation, opposition, appropriation? And, finally, how do they function within the communities that they have helped found, how are they remembered, recreated, redefined, and to which purposes?"", ""Additional Information Teaching Methods\nStudents and instructor meet three times per week: Lectures, 1 x 2 hours per week. Seminar meetings, 2 x 2 hours per week."", ""Method of Assessment\nAssessment: Participation (20%), written task (50%), and final report (30%).\nStudents will only receive credits for the course if their grade for the written exam is 5.5 or higher. They are not allowed to compensate an exam grade that is below 5.5 with other partial grades."", ""Literature\nPrimary and secondary sources; to be announced on Canvas."", ""Additional Information Target Audience\nThis course is only open for first year students of Literature & Society: English, or students enrolled in the Schoolvakminor English Literature.\nPlease note, this course is NOT suitable for exchange students."", ""Additional Information\nThis course is obligatory in the first year. Attendance required: 80% (including lectures, seminars, practicums). Students who miss more than 20% will not receive credits for the course. Exceptions may be made in grave personal circumstances. Make sure to inform both your lecturer and the academic advisor in such cases."", ""Custom Course Registration\nThere is a slightly different enrollment procedure for this module. The standard procedure of the Faculty of Humanities has students sign up for (i) the module, and (ii) the form of tuition (lecture and/or preferred seminar group). However, for this module the instructor will assign the students to the seminar groups. Therefore, students should sign up for (i) the module, but not for (ii) the seminar groups."", ""Recommended background knowledge\nThe history and literature of social movements such as feminism and the abolitionist and anti-apartheid movements.""]",2,"At the end of the course:
Students will be able to recall key concepts and debates about the relationship between literature and society.
Students will understand, interpret and explain literary and critical texts from diverse national, cultural, and historical backgrounds.
Students will be able to apply their knowledge to a variety of literary texts and present their research findings both in writing and verbally.
Students will analyse and break down complex texts and debates to understand their components and relationships.
Students will be able to evaluate, assess and critique literary works and peer feedback, providing constructive criticism.
Students will creatively produce original research and presentations, synthesising their understanding and analysis of the texts.","For centuries, literary and other cultural texts have changed the way people think and look at the world. They reveal social injustices and societal ills, offering ideas and ammunition for social change, thereby helping people to imagine different, better realities. A single text may trigger an individual’s struggle for emancipation, but also that of a group or a nation. This course will explore the important ways in which literary texts have contributed to societal change and have liberated people throughout the centuries up to the present.
The texts we discuss have instigated individual readers as well as collectivities to discover and become aware of injustices, unfairness and abuse. This course analyzes that process, using the following questions as leading threads in the discussions: Which rhetorical strategies employed in the texts evoke the readers’ empathy and possible agency? How do the texts simultaneously assist in emboldening the reader, strengthening an emerging community, and gaining acceptance from a wider audience? In which way do they balance realities that are already being lived and imagined possibilities that have yet to materialize? How do they interact with other expressions of the struggle for emancipation, by way of imitation, opposition, appropriation? And, finally, how do they function within the communities that they have helped found, how are they remembered, recreated, redefined, and to which purposes?","Students and instructor meet three times per week: Lectures, 1 x 2 hours per week. Seminar meetings, 2 x 2 hours per week.","Assessment: Participation (20%), written task (50%), and final report (30%).
Students will only receive credits for the course if their grade for the written exam is 5.5 or higher. They are not allowed to compensate an exam grade that is below 5.5 with other partial grades.",Primary and secondary sources; to be announced on Canvas.,"This course is only open for first year students of Literature & Society: English, or students enrolled in the Schoolvakminor English Literature.
Please note, this course is NOT suitable for exchange students.",The history and literature of social movements such as feminism and the abolitionist and anti-apartheid movements.
W_BA_ANC,Ancient Philosophy,Philosophy,Faculty of Humanities,https://studiegids.vu.nl/en/Bachelor/2025-2026/philosophy,1.0,1.0,6,100,prof. dr. M. Martijn,Lecture,Philosophy,"[""Course Objective\nThe main aim of this course is for students to obtain critical knowledge of the oldest known philosophical traditions, as well as insight into the coherence and importance of these traditions.\nAfter successfully completing this course, students will be able to\ndescribe in their own words, and using core philosophical notions, the development and schools of philosophy in the Greco-Roman traditions;\ndescribe in their own words, and using core philosophical notions, the development and schools of philosophy in the Chinese and Sanskrit traditions;\ndescribe interconnections between the above traditions;\nanalyse at a basic level primary sources from the above traditions."", ""Course Content\nThis course mainly covers the beginnings of philosophy, and does so in two synchronous lines: Greco-Roman on the one hand, and Sanskrit and Chinese traditions on the other hand, starting in the 6th century BCE up until the Global Middle Ages. The course offers a chronological and thematic overview of questions raised in these traditions, such as the nature of reality, knowledge, human beings, and the good life, using primary sources and with an eye to the historical contexts.\nIn period 2 the two lines will be continued in the course 'Medieval Philosophy'."", ""Additional Information Teaching Methods\nInteractive lectures and close-reading seminars. Attendance is mandatory."", ""Method of Assessment\nMandatory reading assignments for the lectures of the first two weeks, consisting of reading questions measuring student progress (pass/ fail). To be admitted to the examination, these assignments must be completed in full.\nWritten final exam, in which knowledge and understanding of the material covered (learning objectives 1-3) as well as text analysis skills (learning objective 4) are tested (100% of the final grade)."", ""Literature\nReading materials will be made available through Canvas."", ""Additional Information Target Audience\nThis course is primarily aimed at BA1 Philosophy students.\nOther students are welcome to enrol.""]",1,"The main aim of this course is for students to obtain critical knowledge of the oldest known philosophical traditions, as well as insight into the coherence and importance of these traditions.
After successfully completing this course, students will be able to
describe in their own words, and using core philosophical notions, the development and schools of philosophy in the Greco-Roman traditions;
describe in their own words, and using core philosophical notions, the development and schools of philosophy in the Chinese and Sanskrit traditions;
describe interconnections between the above traditions;
analyse at a basic level primary sources from the above traditions.","This course mainly covers the beginnings of philosophy, and does so in two synchronous lines: Greco-Roman on the one hand, and Sanskrit and Chinese traditions on the other hand, starting in the 6th century BCE up until the Global Middle Ages. The course offers a chronological and thematic overview of questions raised in these traditions, such as the nature of reality, knowledge, human beings, and the good life, using primary sources and with an eye to the historical contexts.
In period 2 the two lines will be continued in the course 'Medieval Philosophy'.",Interactive lectures and close-reading seminars. Attendance is mandatory.,"Mandatory reading assignments for the lectures of the first two weeks, consisting of reading questions measuring student progress (pass/ fail). To be admitted to the examination, these assignments must be completed in full.
Written final exam, in which knowledge and understanding of the material covered (learning objectives 1-3) as well as text analysis skills (learning objective 4) are tested (100% of the final grade).",Reading materials will be made available through Canvas.,"This course is primarily aimed at BA1 Philosophy students.
Other students are welcome to enrol.",
W_BA_EPEN,Epistemology,Philosophy,Faculty of Humanities,https://studiegids.vu.nl/en/Bachelor/2025-2026/philosophy,1.0,1.0,6,200,dr. C.B. Ranalli,"Seminar, Lecture",Philosophy,"[""Course Objective\nThis course is an introduction to epistemology. The Course Learning Objectives are:\n1. Analyze Philosophical Arguments: To practice and become more comfortable with identifying, extracting, and evaluating arguments in epistemology.\n2. Analyze Philosophical Concepts: To practice and become more comfortable with analyzing key concepts in epistemology using conceptual analysis; and to understand some of the limitations and controversies surround this method (seminar activities and final exam)\n3. Explication and Explanation: To clearly state and explain key epistemological theories, their motivations, and certain key challenges from the course lectures and readings—i.e., to demonstrate awareness of what the major epistemological theories are, what motivations there is for them, and what some of the key challenges facing them are thought to be, drawing on the academic literature we read and explore in epistemology.\n4. Defend Epistemological Views: To clearly state and defend one’s own educated epistemological views in written and verbal form—i.e., by connecting your own educated judgments with the academic literature we read in epistemology.\n5. Apply Epistemology to Contemporary Issues: To apply key epistemological theories, arguments, and objections/replies to cases. This involves some command of many of the previous learning goals, and invites the development and application of your own creativity."", ""Course Content\nEpistemology is the philosophical study of knowledge, belief, truth, rationality, and their applications. It asks descriptive questions like \""what is knowledge?\"" as well as normative questions, like \""when should a person believe what someone tells them?\"" This course introduces students to fundamental concepts and key debates in contemporary epistemology, including some of its social, ethical, and political dimensions. We will address the following topics and questions, exploring the main theories and arguments devised to address them:\nTheory of Knowledge: What is knowledge and what (if anything) is its value? What is the 'traditional' conception of knowledge and what (if anything) is wrong with it?\nPhilosophical analysis: How should we understand epistemological concepts — should they be conceptually analyzed? How do we do that?\nTheory of Justification: What makes a belief justified or rational? Can you be rational in thinking what you do without knowing that your thinking is rational?\nSkepticism: Can we refute skepticism? How?\nPerception: How does perception give us knowledge and rational belief.\nTestimony: How does testimony give us knowledge and rational belief.\nEcho chambers: Can we escape echo chambers? Do filter bubbles make us more dogmatic?\nDisagreement: Does peer disagreement render our moral, political, or religious beliefs unjustified?\nEthics of Belief: Are there 'bad' or wrongful beliefs? How can any beliefs be wrong if we can't chose what we believe?"", ""Additional Information Teaching Methods\nThe format of the course is: lectures and discussion."", ""Method of Assessment\nSeminar activities: Short writing assignments throughout the course (10%) (Learning objectives 1-2, 4-5)\nTiny Ted Talk (presentation) (40%) (Learning objectives 1-5).\nExam: An in-person exam (case-study and critical essay question-based examination) (50%) (Learning objectives 1-5).\nIn order to pass the course, a passing grade needs to be achieved for all three parts of the assessment."", ""Literature\nTextbook:\nDuncan Pritchard, What Is This Thing Called Knowledge? 5th edition. Routledge.\nArticles:\nArticles can be accessed on canvas."", ""Additional Information Target Audience\nBA1-students Philosophy"", ""Explanation Canvas\nAdditional information about this course will be posted at Canvas. All readings are available on canvas."", ""Recommended background knowledge\nRead: The Harvard Guide to Writing the Philosophy Paper.\nRead: Short Guide to Reading Philosophy.""]",1,"This course is an introduction to epistemology. The Course Learning Objectives are:
1. Analyze Philosophical Arguments: To practice and become more comfortable with identifying, extracting, and evaluating arguments in epistemology.
2. Analyze Philosophical Concepts: To practice and become more comfortable with analyzing key concepts in epistemology using conceptual analysis; and to understand some of the limitations and controversies surround this method (seminar activities and final exam)
3. Explication and Explanation: To clearly state and explain key epistemological theories, their motivations, and certain key challenges from the course lectures and readings—i.e., to demonstrate awareness of what the major epistemological theories are, what motivations there is for them, and what some of the key challenges facing them are thought to be, drawing on the academic literature we read and explore in epistemology.
4. Defend Epistemological Views: To clearly state and defend one’s own educated epistemological views in written and verbal form—i.e., by connecting your own educated judgments with the academic literature we read in epistemology.
5. Apply Epistemology to Contemporary Issues: To apply key epistemological theories, arguments, and objections/replies to cases. This involves some command of many of the previous learning goals, and invites the development and application of your own creativity.","Epistemology is the philosophical study of knowledge, belief, truth, rationality, and their applications. It asks descriptive questions like ""what is knowledge?"" as well as normative questions, like ""when should a person believe what someone tells them?"" This course introduces students to fundamental concepts and key debates in contemporary epistemology, including some of its social, ethical, and political dimensions. We will address the following topics and questions, exploring the main theories and arguments devised to address them:
Theory of Knowledge: What is knowledge and what (if anything) is its value? What is the 'traditional' conception of knowledge and what (if anything) is wrong with it?
Philosophical analysis: How should we understand epistemological concepts — should they be conceptually analyzed? How do we do that?
Theory of Justification: What makes a belief justified or rational? Can you be rational in thinking what you do without knowing that your thinking is rational?
Skepticism: Can we refute skepticism? How?
Perception: How does perception give us knowledge and rational belief.
Testimony: How does testimony give us knowledge and rational belief.
Echo chambers: Can we escape echo chambers? Do filter bubbles make us more dogmatic?
Disagreement: Does peer disagreement render our moral, political, or religious beliefs unjustified?
Ethics of Belief: Are there 'bad' or wrongful beliefs? How can any beliefs be wrong if we can't chose what we believe?",The format of the course is: lectures and discussion.,"Seminar activities: Short writing assignments throughout the course (10%) (Learning objectives 1-2, 4-5)
Tiny Ted Talk (presentation) (40%) (Learning objectives 1-5).
Exam: An in-person exam (case-study and critical essay question-based examination) (50%) (Learning objectives 1-5).
In order to pass the course, a passing grade needs to be achieved for all three parts of the assessment.","Textbook:
Duncan Pritchard, What Is This Thing Called Knowledge? 5th edition. Routledge.
Articles:
Articles can be accessed on canvas.",BA1-students Philosophy,"Read: The Harvard Guide to Writing the Philosophy Paper.
Read: Short Guide to Reading Philosophy."
W_BA_ANT,Ancient Philosophy,Philosophy,Faculty of Humanities,https://studiegids.vu.nl/en/Bachelor/2025-2026/philosophy,1.0,1.0,6,100,prof. dr. M. Martijn,Lecture,Philosophy,"[""Course Objective\nHet voornaamste doel van deze cursus is studenten kritische kennis te laten verwerven van de oudste filosofische tradities, alsmede inzicht in de samenhang en het belang van die tradities.\nNa succesvolle afronding van deze cursus, zal de student in staat zijn\nin eigen woorden en met gebruik van centrale filosofische begrippen, de ontwikkeling en scholen van de filosofie in de Grieks-Latijnse tradities te beschrijven;\nin eigen woorden en met gebruik van centrale filosofische begrippen, de ontwikkeling en scholen van de filosofie in de Chinese en Sanskriet-tradities te beschrijven;\ndwarsverbanden tussen de genoemde filosofische tradities de beschrijven;\n(vertaalde) primaire bronnen uit de genoemde filosofische tradities te analyseren op een basaal niveau."", ""Course Content\nDeze cursus beslaat het begin van de filosofie in twee synchrone stromen: de Grieks-Romeinse en de Indiase en Chinese tradities van de 6e eeuw v.C. tot de 7e eeuw n.C.. De cursus biedt een chronologisch en thematisch overzicht van vraagstukken die in die tradities aan bod kwamen, zoals de aard van de werkelijkheid, kennis, de mens en het goede leven, aan de hand van primaire bronnen en met oog voor de historische context.\nIn periode 2 worden deze twee synchrone stromen verder gevolgd in de cursus 'Middeleeuwse filosofie'."", ""Additional Information Teaching Methods\nInteractieve hoorcolleges en tekstcolleges. Aanwezigheid is verplicht."", ""Method of Assessment\nVerplichte leesvragen bij de colleges van de eerste twee weken, ten behoeve van het bijhouden van de studievoortgang (formatief). Om toegelaten te worden tot het tentamen moeten deze opdrachten volledig gemaakt zijn.\nSchriftelijk tentamen, waarin kennis en begrip van de behandelde stof (leerdoelen 1-3) alsmede tekstanalysevaardigheden (leerdoel 4) getoetst worden (100% van het eindcijfer)."", ""Literature\nLiteratuur zal t.z.t. via Canvas beschikbaar gesteld worden."", ""Additional Information Target Audience\nDeze cursus is primair bedoeld voor eerstejaars Filosofiestudenten.\nStudenten uit andere studierichtingen zijn welkom.""]",1,"Het voornaamste doel van deze cursus is studenten kritische kennis te laten verwerven van de oudste filosofische tradities, alsmede inzicht in de samenhang en het belang van die tradities.
Na succesvolle afronding van deze cursus, zal de student in staat zijn
in eigen woorden en met gebruik van centrale filosofische begrippen, de ontwikkeling en scholen van de filosofie in de Grieks-Latijnse tradities te beschrijven;
in eigen woorden en met gebruik van centrale filosofische begrippen, de ontwikkeling en scholen van de filosofie in de Chinese en Sanskriet-tradities te beschrijven;
dwarsverbanden tussen de genoemde filosofische tradities de beschrijven;
(vertaalde) primaire bronnen uit de genoemde filosofische tradities te analyseren op een basaal niveau.","Deze cursus beslaat het begin van de filosofie in twee synchrone stromen: de Grieks-Romeinse en de Indiase en Chinese tradities van de 6e eeuw v.C. tot de 7e eeuw n.C.. De cursus biedt een chronologisch en thematisch overzicht van vraagstukken die in die tradities aan bod kwamen, zoals de aard van de werkelijkheid, kennis, de mens en het goede leven, aan de hand van primaire bronnen en met oog voor de historische context.
In periode 2 worden deze twee synchrone stromen verder gevolgd in de cursus 'Middeleeuwse filosofie'.",Interactieve hoorcolleges en tekstcolleges. Aanwezigheid is verplicht.,"Verplichte leesvragen bij de colleges van de eerste twee weken, ten behoeve van het bijhouden van de studievoortgang (formatief). Om toegelaten te worden tot het tentamen moeten deze opdrachten volledig gemaakt zijn.
Schriftelijk tentamen, waarin kennis en begrip van de behandelde stof (leerdoelen 1-3) alsmede tekstanalysevaardigheden (leerdoel 4) getoetst worden (100% van het eindcijfer).",Literatuur zal t.z.t. via Canvas beschikbaar gesteld worden.,"Deze cursus is primair bedoeld voor eerstejaars Filosofiestudenten.
Studenten uit andere studierichtingen zijn welkom.",
